{
  "id": "module-06",
  "title": "Module 5: MVVM Architecture with Riverpod",
  "description": "Learn professional app architecture with the MVVM pattern and Riverpod state management. Structure your code for maintainability, testability, and team collaboration.",
  "difficulty": "intermediate",
  "estimatedHours": 12,
  "order": 6
}
