{
  "id": "module-16",
  "title": "Capstone Project: Task Manager Application",
  "description": "Build a complete full-stack Task Manager application from scratch. Apply everything you've learned: Spring Boot, JPA, REST APIs, React frontend, authentication, and deployment.",
  "difficulty": "advanced",
  "estimatedHours": 12,
  "order": 16
}