{
  "id": "module-security",
  "title": "Security: Sessions & JWT",
  "description": "Master web application security from fundamentals through Spring Security, session-based authentication, JWT tokens, and role-based access control.",
  "difficulty": "advanced",
  "estimatedHours": 3.25,
  "order": 12
}