{
  "id": "module-20",
  "title": "Authentication Fundamentals",
  "description": "Secure your applications with ASP.NET Core Identity, cookies, and JWT tokens. Learn the complete authentication story for web applications and APIs.",
  "difficulty": "intermediate",
  "estimatedHours": 4,
  "order": 20
}
